{"completed_at_utc":"2026-07-15T16:03:26.290164Z","report_path":"docs/stage-3-review-summary.md","report_sha256":"903389ea8b523a1b8c0488e9ae74049f0c2c7ef9daa9447c4e1873142211fc41","review_id":"stage3-review-v1-final-20260715","reviewed_aggregate_sha256":"d0f8b186210062a86f313611968ade7a8de089e2fb25de99e9c61c235ec9a236","reviewed_manifest_sha256":"9296a7308f64db49d77df1328554df6e6552423046984eea6f0e567a083adedb","reviewer_identity":"codex-review-cycle-final-assessment","schema_version":1,"transition_orchestrator_sha256":"526ff36a237b946628727b9092688ea1eb5be78f688aa7f9c9ad8554e864f5b7","unresolved_blocking_findings":0,"verdict":"pass","verification_evidence_path":"reviews/stage3-verification-final-20260715.json","verification_evidence_sha256":"8eca97779815991b2615927d443bfeea049de13c094d29a0a4fcef1a284bc47c"}
